id,show_id,type,title,director,cast,country,date_added,release_year,rating,listed_in,description,duration_int,duration_type
ts1004,s1004,tv show,lego star wars: droid tales,,"tom kane, anthony daniels, trevor devall, kirby morrow, sam vincent, michael donovan",united states,2019-11-12,2014,tv-y7,"action-adventure, animation, comedy",c-3po recounts the great adventures of the rebels.,1,season
ts1005,s1005,tv show,lego star wars: resistance rises (shorts),,,"united states, denmark",2019-11-12,2015,tv-y7-fv,"action-adventure, animation, comedy",follow five untold stories before the force awakened.,1,season
ts1006,s1006,tv show,lego star wars: the freemaker adventures,,"matt sloan, trevor devall, greg baldwin, michael daingerfield, vanessa lengies, grey griffin",united states,2019-11-12,2015,tv-y7,"action-adventure, animation, comedy",12-year old rowan freemaker discovers the kyber saber.,2,seasons
ts1007,s1007,tv show,lego star wars: the freemaker adventures (shorts),,,,2019-11-12,2016,tv-y7,"action-adventure, animation, comedy",the freemakers lend a helping hand to the rebel fleet.,1,season
ts1008,s1008,movie,lego star wars: the new yoda chronicles - clash of the skywalkers,michael hegner,"tom kane, anthony daniels, matt sloan, trevor devall, kirby morrow, sam vincent",united states,2019-11-12,2014,tv-y7,"action-adventure, animation, comedy",the enraged emperor sends darth vader to destroy luke.,24,min
ts1009,s1009,movie,lego star wars: the new yoda chronicles - raid on coruscant,michael hegner,"tom kane, anthony daniels, matt sloan, trevor devall, kirby morrow, sam vincent","denmark, china",2019-11-12,2014,tv-y7,"action-adventure, animation, comedy",luke skywalker attempts a daring raid on coruscant.,24,min
ts1010,s1010,movie,lego star wars: the new yoda chronicles – duel of the skywalkers,michael hegner,"tom kane, anthony daniels, matt sloan, trevor devall, kirby morrow, sam vincent",united states,2019-11-12,2014,tv-y7,"action-adventure, animation, comedy",luke skywalker accidently opens a remaining holocron.,24,min
ts1011,s1011,movie,lego star wars: the new yoda chronicles – escape from the jedi temple,michael hegner,"tom kane, anthony daniels, matt sloan, trevor devall, sam vincent, kelly metzger",united states,2019-11-12,2014,tv-y7,"action-adventure, animation, comedy",yoda and obi-wan recall freeing the holocrons from the temple.,24,min
ts1012,s1012,movie,lego star wars: the new yoda chronicles – race for the holocrons,michael hegner,"tom kane, anthony daniels, matt sloan, trevor devall, brian drummond, michael donovan",united states,2019-11-12,2014,tv-y7,"action-adventure, animation, comedy",obi-wan urges luke to travel to tatooine.,24,min
ts1013,s1013,movie,lemonade mouth,patricia riggen,"bridgit mendler, adam hicks, hayley kiyoko, naomi scott, blake michael, nick roux",united states,2019-11-12,2011,tv-g,"coming of age, drama, music",a ragtag group of freshmen come together in the name of rock 'n' roll.,110,min
ts1014,s1014,movie,lend a paw,clyde geronimi,,united states,2019-11-12,1941,tv-y7,"animation, family, kids",pluto's jealousy of a kitten leaves him conflicted about rescuing it. see details for advisory.,8,min
ts1015,s1015,movie,leroy & stitch,"roberts gannaway, tony craig","daveigh chase, chris sanders, david stiers, kevin mcdonald, tia carrere, kevin michael richardson",united states,2019-11-12,2006,g,"action-adventure, animation, comedy","dr. hamsterviel forces jumba to create leroy, the evil twin of stitch.",76,min
ts1016,s1016,movie,let it shine,paul hoen,"tyler williams, coco jones, trevor jackson, brandon smith, dawnn lewis, alex désert",united states,2019-11-12,2012,tv-g,"coming of age, drama, music",a true poet overcomes self-doubt and shows everyone his artistic genius.,103,min
ts1017,s1017,movie,life is ruff,charles haid,"kyle massey, kay panabaker, mitchel musso, carter jenkins, mark lawrence, judith moreland",united states,2019-11-12,2005,tv-g,"animals & nature, comedy, coming of age",a teenager enters an adopted mutt into a dog show to try to win $5000.,85,min
ts1018,s1018,movie,life with mikey,james lapine,"michael fox, nathan lane, cyndi lauper, david krumholtz, david huddleston, christina vidal",united states,2019-11-12,1993,pg,"buddy, comedy, coming of age",an ex-child star struggling as an agent discovers a sassy new client.,92,min
ts1019,s1019,movie,life-size 2,steven tsuchida,"tyra banks, francia raisa, gavin stenhouse, hank chen, alison fernandez, shanica knowles",united states,2019-11-12,2018,tv-14,"comedy, coming of age, fantasy",eve magically awakes to help get grace back on track.,82,min
ts1020,s1020,movie,lifted,gary rydstrom,,united states,2019-11-12,2006,g,"animation, comedy, family",a young alien bungles his first lesson in abduction.,5,min
ts1021,s1021,movie,lilo & stitch,"christopher sanders, dean deblois","daveigh chase, christopher sanders, tia carrere, david ogden stiers, kevin mcdonald, ving rhames",united states,2019-11-12,2002,tv-pg,"action-adventure, animation, family",a little girl adopts a wanted alien wreaking havoc on the hawaiian islands.,86,min
ts1022,s1022,movie,lilo & stitch 2: stitch has a glitch,"tony leondis, michael labash","christopher sanders, dakota fanning, tia carrere, david stiers, kevin mcdonald, kunewa mook",united states,2019-11-12,2005,pg,"animation, comedy, dance",a glitch sends stich out of control just before lilo's big hula contest.,70,min
ts1023,s1023,tv show,lizzie mcguire,,"hilary duff, lalaine , adam lamberg, jake thomas, hallie todd, robert carradine",united states,2019-11-12,2000,tv-g,"comedy, coming of age, kids","lizzie mcguire has great friends, a great family and even great foes. get inside her head.",2,seasons
ts1024,s1024,movie,lonesome ghosts,burt gillett,,united states,2019-11-12,1937,tv-y7,"animation, family, kids","mickey mouse, donald duck and goofy run a ghost exterminating agency. see details for advisory.",9,min
ts1025,s1025,tv show,lost treasures of the maya,,albert lin,"united states, guatemala",2019-11-12,2018,tv-pg,"docuseries, historical",a high-tech treasure map rewrites the history of the ancient maya in the guatemalan jungle.,1,season
ts1026,s1026,movie,lou,dave mullins,,united states,2019-11-12,2017,g,"action-adventure, animation, comedy",a toy-stealing bully meets his match in a lost & found box.,7,min
ts1027,s1027,movie,luck of the irish,paul hoen,"paul kiernan, timothy omundson, ryan merriman, glenndon chatman, henry gibson, marita geraghty",united states,2019-11-12,2001,tv-g,"comedy, coming of age, fantasy","when his lucky charm is stolen, kyle learns that he is part leprechaun.",86,min
ts1028,s1028,movie,luxo jr.,,,united states,2019-11-12,1986,g,"animation, comedy, family",a baby lamp finds a ball to play with.,2,min
ts1029,s1029,movie,magician mickey,david hand,"pinto colvig, walt disney, clarence nash",united states,2019-11-12,1937,tv-pg,"animation, comedy, family",donald continually heckles mickey's magic act. see details for advisory.,8,min
ts1030,s1030,movie,mail dog,charles nichols,,united states,2019-11-12,1947,tv-g,"animation, comedy, family",pluto must deliver mail to a remote outpost. see details for advisory.,7,min
ts1031,s1031,movie,man among cheetahs,,bob poole,united states,2019-11-12,2017,tv-pg,"animals & nature, documentary, family",a wildlife filmmaker tries to keep up with a cheetah mom determined to keep her cubs alive.,44,min
ts1032,s1032,movie,mars: inside spacex,julia reagan,,united states,2019-11-12,2018,tv-pg,documentary,go behind the scenes as elon musk and his engineers prepare for the falcon heavy rocket launch.,47,min
ts1033,s1033,tv show,marvel comics x-men,,"cedric smith, catherine disher, alyson court, chris potter, george buza, iona morris","united states, canada",2019-11-12,1992,tv-y7,"action-adventure, animation, fantasy",in the marvel comics universe mutants are persecuted by a hateful and fearful populous.,5,seasons
ts1034,s1034,tv show,marvel rising: initiation (shorts),,,united states,2019-11-12,2017,tv-y7,"action-adventure, animation, kids",ghost-spider is falsely accused of her friend's death.,1,season
ts1035,s1035,movie,marvel rising: secret warriors,alfred gimeno,"dee baker, chloe bennet, kathreen khavari, andrew kishino, meera kumbhani, kamil mcfadden",united states,2019-11-12,2018,tv-y7-fv,"action-adventure, animation, coming of age",marvel’s young powered heroes join forces to protect the universe.,80,min
ts1036,s1036,movie,marvel studios: assembling a universe,,"jeff mcneil, meghan leon, jason hillhouse, robert downey jr., clark gregg, jon favreau",united states,2019-11-12,2014,tv-pg,"action-adventure, documentary, superhero",an exclusive look inside the world of marvel studios.,43,min
ts1037,s1037,movie,marvel studios: expanding the universe,,,,2019-11-12,2019,tv-pg,"documentary, family",an exciting look into the future of marvel studios’ films and upcoming disney+ series.,13,min
ts1038,s1038,movie,marvel studios' ant-man,peyton reed,"paul rudd, evangeline lilly, corey stoll, bobby cannavale, michael peña, tip harris",united states,2019-11-12,2015,pg-13,"action-adventure, comedy, science fiction",scott lang and dr. hank pym plan a heist that could save the world.,119,min
ts1039,s1039,movie,marvel studios' avengers: age of ultron,joss whedon,"robert downey jr., chris hemsworth, mark ruffalo, chris evans, scarlett johansson, jeremy renner",united states,2019-11-12,2015,pg-13,"action-adventure, science fiction, superhero",tony stark unwittingly creates an a.i. monster bent on destroying mankind.,143,min
ts1040,s1040,movie,marvel studios' avengers: endgame,"anthony russo, joe russo","robert downey jr., chris evans, mark ruffalo, chris hemsworth, scarlett johansson, jeremy renner",united states,2019-11-12,2019,pg-13,"action-adventure, fantasy, science fiction","the epic finale to the infinity saga, this dramatic showdown pits the avengers against thanos.",183,min
ts1041,s1041,movie,marvel studios' captain america: civil war,"anthony russo, joe russo","chris evans, robert downey jr., scarlett johansson, sebastian stan, anthony mackie, don cheadle",united states,2019-11-12,2016,pg-13,"action-adventure, science fiction, superhero","captain america and iron man clash, causing the avengers to choose sides.",150,min
ts1042,s1042,movie,marvel studios' captain america: the first avenger,joe johnston,"chris evans, tommy jones, hugo weaving, hayley atwell, sebastian stan, dominic cooper",united states,2019-11-12,2011,pg-13,"action-adventure, science fiction, superhero",a top-secret research project turns steve rogers into captain america.,126,min
ts1043,s1043,movie,marvel studios' captain america: the winter soldier,"anthony russo, joe russo","chris evans, scarlett johansson, sebastian stan, anthony mackie, cobie smulders, frank grillo",united states,2019-11-12,2014,pg-13,"action-adventure, science fiction, superhero",captain america and black widow join forces against the winter soldier.,138,min
ts1044,s1044,movie,marvel studios' captain marvel,"anna boden, ryan fleck","brie larson, samuel jackson, ben mendelsohn, djimon hounsou, lee pace, lashana lynch","united states, australia",2019-11-12,2019,pg-13,"action-adventure, science fiction, superhero",marvel studios’ captain marvel launches the mcu’s most powerful hero.,126,min
ts1045,s1045,movie,marvel studios' doctor strange,scott derrickson,"benedict cumberbatch, chiwetel ejiofor, rachel mcadams, benedict wong, michael stuhlbarg, benjamin bratt",united states,2019-11-12,2016,pg-13,"action-adventure, fantasy, superhero",a famous surgeon battles unseen forces bent on destroying our reality.,116,min
ts1046,s1046,movie,marvel studios' guardians of the galaxy,james gunn,"chris pratt, zoë saldana, dave bautista, vin diesel, bradley cooper, lee pace",united states,2019-11-12,2014,pg-13,"action-adventure, comedy, science fiction",a group of misfit heroes become the object of an unrelenting bounty hunt.,122,min
ts1047,s1047,movie,marvel studios' guardians of the galaxy vol. 2,james gunn,"chris pratt, bradley cooper, vin diesel, pom klementieff, zoë saldana, dave bautista",united states,2019-11-12,2017,pg-13,"action-adventure, comedy, science fiction",the guardians fight to keep their newfound family together as they discover quill's parentage.,137,min
ts1048,s1048,movie,marvel studios' iron man,jon favreau,"robert downey jr., terrence howard, jeff bridges, gwyneth paltrow, leslie bibb, shaun toub","united states, canada",2019-11-12,2008,pg-13,"action-adventure, science fiction, superhero",jet-setting industrialist tony stark vows to protect the world as iron man.,127,min
ts1049,s1049,movie,marvel studios' iron man 2,jon favreau,"robert downey jr., gwyneth paltrow, don cheadle, scarlett johansson, sam rockwell, clark gregg",united states,2019-11-12,2010,pg-13,"action-adventure, science fiction, superhero",inventor tony stark forges new alliances to confront powerful enemies.,125,min
ts1050,s1050,movie,marvel studios' iron man 3,shane black,"robert downey jr., gwyneth paltrow, don cheadle, guy pearce, rebecca hall, stephanie szostak",united states,2019-11-12,2013,pg-13,"action-adventure, science fiction, superhero","his personal world destroyed, tony stark embarks on a harrowing quest to find those responsible.",132,min
ts1051,s1051,movie,marvel studios' the avengers,joss whedon,"robert downey jr., chris evans, mark ruffalo, chris hemsworth, scarlett johansson, jeremy renner",united states,2019-11-12,2012,pg-13,"action-adventure, fantasy, science fiction",nick fury recruits a team of heroes to battle an unexpected enemy.,145,min
ts1052,s1052,movie,marvel studios' thor,kenneth branagh,"chris hemsworth, natalie portman, tom hiddleston, anthony hopkins, stellan skarsgård, kat dennings",united states,2019-11-12,2011,pg-13,"action-adventure, fantasy, superhero","thor, asgard's greatest hero, reignites an ancient war that he must take part in from earth.",116,min
ts1053,s1053,movie,marvel studios' thor: the dark world,alan taylor,"chris hemsworth, natalie portman, tom hiddleston, anthony hopkins, rene russo, stellan skarsgård",united states,2019-11-12,2013,pg-13,"action-adventure, fantasy, science fiction",thor must set out on his most dangerous and personal journey yet.,114,min
ts1054,s1054,tv show,marvel ultimate spider-man,,"drake bell, chi mcbride, steven weber, j.k. simmons, tom kenny, clark gregg",united states,2019-11-12,2011,tv-y7,"action-adventure, animation, fantasy",spider-man trains alongside four fellow teenage superheroes.,4,seasons
ts1055,s1055,tv show,marvel's agent carter,,"hayley atwell, james d'arcy, chad murray, enver gjokaj, shea whigham",united states,2019-11-12,2014,tv-14,"action-adventure, science fiction, spy/espionage","working for ssr, peggy would rather be in the field.",2,seasons
ts1056,s1056,tv show,marvel's ant-man (shorts),,,united states,2019-11-12,2016,tv-y7,"action-adventure, animation, comedy",ant-man protects the world one inch at a time!,1,season
ts1057,s1057,tv show,marvel's avengers assemble,,"adrian pasdar, fred tatasciore, roger smith, travis willingham, troy baker, bumper robinson",united states,2019-11-12,2012,tv-y7,"action-adventure, animation, kids",marvel’s mightiest heroes combine their power.,5,seasons
ts1058,s1058,tv show,marvel's avengers: secret wars (shorts),,,,2019-11-12,2016,tv-y7,"action-adventure, animation, kids",a new team of heroes joins the avengers.,1,season
ts1059,s1059,tv show,marvel's guardians of the galaxy (series),,"will friedle, trevor devall, kevin richardson, vanessa marshall, david sobolov",united states,2019-11-12,2015,tv-y7,"action-adventure, animation, kids",the guardians find a map leading to a powerful weapon.,3,seasons
ts1060,s1060,tv show,marvel's guardians of the galaxy (shorts),,,,2019-11-12,2014,tv-y7,"action-adventure, animation, kids",the stories of five outlaws who became the guardians.,2,seasons
ts1061,s1061,tv show,marvel's hero project,,,united states,2019-11-12,2019,tv-pg,"docuseries, family","celebrate the inspiring efforts of young, real life heroes as they join marvel’s hero project.",1,season
ts1062,s1062,tv show,marvel's inhumans,,"anson mount, serinda swan, ken leung, eme ikwuakor, isabelle cornish, ellen woglom",united states,2019-11-12,2017,tv-14,"action-adventure, science fiction, superhero",the never-before-told adventure of the royal family.,1,season
ts1063,s1063,tv show,marvel's rocket & groot (shorts),,,,2019-11-12,2016,tv-y7,"action-adventure, animation, buddy",rocket and groot shop for a new ship.,1,season
ts1064,s1064,tv show,marvel's ultimate comics,,"cole howard, brian drummond",,2019-11-12,2016,tv-y7,"action-adventure, animation, comedy",spidey and iron man team-up. black panther vs. ghost.,1,season
ts1065,s1065,movie,mary poppins,robert stevenson,"julie andrews, dick van dyke, david tomlinson, glynis johns, hermione baddeley, karen dotrice",united states,2019-11-12,1964,g,"family, fantasy, musical",a magical nanny reconnects a father and mother with their two children.,142,min
ts1066,s1066,movie,mater and the ghostlight,john lasseter,"larry the cable guy , owen wilson, michael wallis, bonnie hunt, paul newman, cheech marin",united states,2019-11-12,2006,tv-y7,"animation, comedy, family",mater ponders if the legend of the ghostlight is true.,8,min
ts1067,s1067,movie,meet the deedles,steve boyum,"paul walker, steve wormer, john ashton, a.j. langer, robert englund, megan cavanagh",united states,2019-11-12,1998,pg,"buddy, comedy",two surfer dudes try to stop an ex-park ranger from stealing old faithful.,94,min
ts1068,s1068,movie,meet the robinsons,stephen anderson,"angela bassett, daniel hansen, jordan fry, matthew josten, john ford, dara mcgarry",united states,2019-11-12,2007,g,"action-adventure, animation, family",a young inventor uses time travel to find the family he never knew.,97,min
ts1069,s1069,movie,melody time,"clyde geronimi, jack kinney, hamilton luske","roy rogers, trigger , dennis day, the andrews sisters , fred waring and his pennsylvanians , freddy martin",united states,2019-11-12,1948,tv-pg,"animation, anthology, family",classic stories blend high-spirited music and unforgettable characters. see details for advisory.,76,min
ts1070,s1070,movie,mickey down under,charles nichols,,united states,2019-11-12,1948,tv-g,"animation, comedy, family",mickey and pluto vacation in australia. see details for advisory.,7,min
ts1071,s1071,tv show,mickey mouse (shorts),,,united states,2019-11-12,2012,tv-g,"animation, kids","all-new series of cartoon shorts, mickey mouse finds himself in silly situations around the world!",5,seasons
ts1072,s1072,tv show,mickey mouse club (1955-59),,,united states,2019-11-12,1955,tv-pg,"family, variety",the mickey mouse club is a variety show featuring the mouseketeers. see details for advisory.,1,season
ts1073,s1073,movie,"mickey, donald, goofy: the three musketeers",donovan cook,"wayne allwine, tony anselmo, bill farmer, russi taylor, tress macneille, jim cummings",united states,2019-11-12,2004,g,"action-adventure, animation, family",an animated version of the classic tale starring three disney favorites.,71,min
ts1074,s1074,movie,mickey's birthday party,riley thomson,"walt disney, thelma boardman, pinto colvig, clarence nash, florence gill",united states,2019-11-12,1942,tv-g,"animation, comedy, family",the gang gives mickey a surprise birthday party. see details for advisory.,9,min
ts1075,s1075,movie,mickey's christmas carol,burny mattinson,"alan young, wayne allwine, hal smith, will ryan, eddy carroll, patricia parris",united states,2019-11-12,1983,g,"animation, comedy, family",all your disney pals star in this retelling of a dickens christmas classic.,26,min
ts1076,s1076,movie,mickey's delayed date,charles nichols,,united states,2019-11-12,1947,tv-g,"animation, comedy, family",pluto helps mickey get ready when he forgets about his big date. see details for advisory.,7,min
ts1077,s1077,movie,mickey's once upon a christmas,"bradley raymond, jun falkenstein, bill speers","kelsey grammer, wayne allwine, russi taylor, tony anselmo, diane michelle, tress macneille",united states,2019-11-12,1999,tv-g,"animation, anthology, comedy",join mickey and his pals for tales of their most memorable christmases.,67,min
ts1078,s1078,movie,mickey's rival,"wilfred jackson, walt disney","walt disney, marcelite garner, sonny dawson",united states,2019-11-12,1936,tv-g,"animation, comedy, family","mickey's rival, mortimer, strives for minnie's affections. see details for advisory.",9,min
ts1079,s1079,movie,mickey's trailer,ben sharpsteen,"clarence nash, pinto colvig, walt disney",united states,2019-11-12,1938,tv-pg,"animation, comedy, family","mickey, donald and goofy are on an adventurous car trip. see details for advisory.",8,min
ts1080,s1080,movie,mickey's twice upon a christmas,matthew o'callaghan,"wayne allwine, tony anselmo, jeff bennett, jim cummings, bill farmer, tress macneille",united states,2019-11-12,2004,g,"animation, anthology, comedy",mickey and his pals learn the true meaning of christmas…with santa's help.,70,min
ts1081,s1081,movie,mighty joe young,ron underwood,"bill paxton, charlize theron, rade šerbedžija, regina king, peter firth, naveen andrews",united states,2019-11-12,1998,pg,"action-adventure, animals & nature, family","taken to hollywood to hide, a mighty gorilla is chased by a hunter.",116,min
ts1082,s1082,movie,mike's new car,"pete docter, roger gould","billy crystal, john goodman",united states,2019-11-12,2002,tv-g,"animation, buddy, comedy",mike and sulley try to take mike's new car for a ride.,5,min
ts1083,s1083,movie,minutemen,lev spiro,"jason dolley, luke benward, nicholas braun, chelsea staub, steven mcqueen, kara crane",united states,2019-11-12,2008,tv-g,"action-adventure, comedy, science fiction",three teen outcasts invent a time machine to save their social lives.,91,min
ts1084,s1084,movie,miracle,gavin o'connor,"kurt russell, patricia clarkson, noah emmerich, sean mccann, kenneth welsh, eddie cahill","canada, united states",2019-11-12,2004,pg,"drama, historical, sports",the story of the 1980 u.s. olympic hockey team's win over a seemingly invincible soviet squad.,137,min
ts1085,s1085,movie,miracle at midnight,ken cameron,"sam waterston, mia farrow, justin whalin, patrick malahide, benedick blythe",united states,2019-11-12,1998,tv-14,"drama, historical",a family risks their lives to help their neighbors escape the nazis.,89,min
ts1086,s1086,movie,miracle in lane 2,greg beeman,"frankie muniz, rick rossovich, molly hagan, patrick levis, roger brown, tuc watkins",united states,2019-11-12,2000,tv-g,"biographical, drama, sports",a physically challenged boy strives to compete in a national soapbox derby.,90,min
ts1087,s1087,movie,miracle landing on the hudson,,"todd boyce, miriam lucia, james mcgregor, nathan nolan, phillip wright",united states,2019-11-12,2014,tv-g,"action-adventure, documentary","the true story of the terrifying, ultimately triumphant landing of flight 1549 in the hudson river.",44,min
ts1088,s1088,movie,mission to the sun,daniel smith,"henry goodman, jack baker",united states,2019-11-12,2018,tv-pg,documentary,a nasa mission to study the sun gathers data on potentially devastating solar storms.,44,min
ts1089,s1089,movie,moana,"john musker, ron clements","auli'i cravalho, dwayne johnson, rachel house, temuera morrison, nicole scherzinger, jemaine clement",united states,2019-11-12,2016,pg,"action-adventure, animation, family",moana and maui set sail on a journey across the ocean to save the world.,108,min
ts1090,s1090,movie,mom's got a date with a vampire,stephen boyum,"matthew o'leary, laura vandervoort, myles jeffrey, caroline rhea, charles shaughnessy, robert carradine","canada, united states",2019-11-12,2000,tv-pg,"comedy, fantasy",two kids set up their mom on a date with a vampire.,83,min
ts1091,s1091,movie,monsters university,dan scanlon,"billy crystal, john goodman, steve buscemi, helen mirren, peter sohn, joel murray",united states,2019-11-12,2013,g,"animation, buddy, comedy",discover how mike and sulley first met at monsters university.,104,min
ts1092,s1092,movie,"monsters, inc.",pete docter,"john goodman, billy crystal, mary gibbs, steve buscemi, james coburn, jennifer tilly",united states,2019-11-12,2001,g,"animation, buddy, comedy",a little girl named boo wanders into the world of monsters.,93,min
ts1093,s1093,movie,motocrossed,steve boyum,"alana austin, riley smith, mary-margaret humes, trever o'brien, timothy carhart, scott terra",united states,2019-11-12,2001,tv-g,"drama, sports",andi takes her brother's spot in a motocross race after he injures his leg.,92,min
ts1094,s1094,movie,mr. boogedy,oz scott,"richard masur, mimi kennedy, benjamin gregory, david faustino, kristy swanson, howard witt",united states,2019-11-12,1986,tv-pg,"comedy, fantasy",a new england family finds their new home is haunted by a local legend.,46,min
ts1095,s1095,movie,mr. duck steps out,jack king,,united states,2019-11-12,1940,tv-g,"animation, comedy, family",donald attempts to court daisy. see details for advisory.,9,min
ts1096,s1096,movie,mr. mouse takes a trip,clyde geronimi,,united states,2019-11-12,1940,tv-g,"animation, comedy, family",mickey mouse and pluto hit the road - and run into trouble. see details for advisory.,8,min
ts1097,s1097,movie,mulan ii,"darrell rooney, lynne southerland","ming-na wen, b.d. wong, mark moseley, lucy liu, harvey fierstein, sandra oh","united states, south korea, singapore, russia, malaysia, kazakhstan, taiwan, hong kong, japan, china, india, syria, iran, egypt, pakistan",2019-11-12,2005,g,"action-adventure, animation, family",mulan must complete a dangerous mission before marrying general shang.,82,min
ts1098,s1098,tv show,muppet moments (shorts),,,united states,2019-11-12,2014,tv-y7,"anthology, comedy, kids",join the muppets as they share unforgettable moments.,1,season
