id,show_id,type,title,director,cast,country,date_added,release_year,rating,listed_in,description,duration_int,duration_type
ts406,s406,tv show,becoming,,,united states,2020-09-18,2020,tv-pg,"anthology, docuseries, family","becoming chronicles the origin stories of world-class entertainers, musicians and athletes.",1,season
ts407,s407,tv show,coop & cami ask the world,,"ruby turner, dakota lotus, olivia sanabia, albert tsai, paxton booth, rebecca metz",united states,2020-09-18,2018,tv-g,"comedy, family, kids","cooper and cami wrather co-host ""would you wrather.""",2,seasons
ts408,s408,tv show,europe from above,,julian barratt,united kingdom,2020-09-18,2019,tv-g,"docuseries, reality",europe from above takes to the air over europe’s finest cultural and geographical landmarks.,1,season
ts409,s409,movie,ever after: a cinderella story,andy tennant,"drew barrymore, anjelica huston, dougray scott, patrick godfrey, megan dodds, melanie lynskey",united states,2020-09-18,1998,pg-13,"drama, romance",a young woman falls in love with a prince while pretending to be a princess.,122,min
ts410,s410,tv show,kingdom of the mummies,,kerry shale,united states,2020-09-18,2020,tv-14,"docuseries, historical, reality",a team of archaeologists uncover the first egyptian funeral parlor ever found.,1,season
ts411,s411,movie,morning light,mark monroe,patrick warburton,united states,2020-09-18,2008,pg,"documentary, sports","fifteen rookie sailors race to be part of the ""morning light"" crew.",99,min
ts412,s412,movie,notre dame: race against the inferno,"fabrice gardel, simon kessler, josselin mahot",paul bandey,"united kingdom, france",2020-09-18,2019,tv-pg,documentary,"on april 15, 2019, paris’ firefighters gave everything to save the notre dame cathedral.",45,min
ts413,s413,tv show,once upon a time,,"ginnifer goodwin, jennifer morrison, robert carlyle, lana parrilla, jared gilmore, josh dallas",united states,2020-09-18,2011,tv-pg,"action-adventure, fantasy, soap opera / melodrama",fairy tale characters inhabit a land of good and evil.,7,seasons
ts414,s414,tv show,soy luna,,"karol sevilla, ruggero pasquarelli, valentina zenere, lucila gandolfo, michael ronda, carolina kopelioff","argentina, mexico",2020-09-18,2015,tv-g,"comedy, coming of age, drama",luna will learn that love transcends distance.,3,seasons
ts415,s415,tv show,violetta,,"diego ramos, martina stoessel, pablo espinosa, jorge blanco, mercedes lambre, nicolás garnier",argentina,2020-09-18,2011,tv-g,"coming of age, drama, music",violetta is a talented teen following her dream.,3,seasons
ts416,s416,movie,christopher robin,marc forster,"ewan mcgregor, hayley atwell, bronte carmichael, mark gatiss, oliver davies, ronke adekoluejo","united kingdom, united states",2020-09-11,2018,pg,"drama, family, fantasy",pooh leaves the hundred acre wood to help grown-up christopher robin.,109,min
ts417,s417,movie,d2: the mighty ducks,sam weisman,"emilio estevez, michael tucker, jan rubeš, kathryn erbe, joshua jackson, elden ratliff",united states,2020-09-04,1994,pg,"comedy, drama, family",the mighty ducks face the meanest team on ice at the junior goodwill games.,107,min
ts418,s418,movie,d3: the mighty ducks,robert lieberman,"emilio estevez, jeffrey nordling, david selby, heidi kling, joshua jackson, elden ratliff",united states,2020-09-04,1996,pg,"comedy, coming of age, drama",the mighty ducks inherit a new coach and a new set of problems.,104,min
ts419,s419,tv show,earth to ned,,,united states,2020-09-04,2020,tv-pg,"comedy, parody, science fiction","from the jim henson company, alien commander ned hosts a late-night talk show with celebrity guests.",1,season
ts420,s420,movie,trick or treat,jack hannah,,united states,2020-09-04,1952,tv-g,"animation, family, fantasy","donald plays a trick on his nephews, but a witch helps them out. see details for advisory.",9,min
ts421,s421,movie,alice through the looking glass,james bobin,"johnny depp, anne hathaway, mia wasikowska, matt lucas, rhys ifans, helena carter","united states, united kingdom",2020-08-28,2016,pg,"action-adventure, fantasy",alice returns to underland to save the mad hatter in a race against time.,115,min
ts422,s422,movie,phineas and ferb the movie: candace against the universe,,"ashley tisdale, vincent martella, ali wong, dan povenmire, alyson stoner, maulik pancholy",united states,2020-08-28,2020,tv-g,"action-adventure, animation, comedy","phineas and ferb set out across the galaxy to rescue candace, who has been abducted by aliens.",86,min
ts423,s423,movie,back to the titanic,,,united kingdom,2020-08-21,2020,tv-pg,"documentary, historical",back to the titanic documents the first manned dives to titanic in nearly 15 years.,44,min
ts424,s424,movie,beauty and the beast,bill condon,"emma watson, dan stevens, luke evans, kevin kline, josh gad, ewan mcgregor",united states,2020-08-21,2017,pg,"family, fantasy, musical",belle must look beyond the beast’s exterior to find the true prince within.,138,min
ts425,s425,movie,mars: one day on the red planet,martin johnson,nigel barber,united states,2020-08-21,2020,tv-pg,documentary,"an epic journey around the real mars – built from data, as you’ve never seen it before.",88,min
ts426,s426,movie,the one and only ivan,thea sharrock,"sam rockwell, angelina jolie, danny devito, helen mirren, brooklynn prince, ramón rodríguez",united states,2020-08-21,2020,pg,"drama, family, fantasy",an adaptation of the award-winning book about a very special gorilla.,95,min
ts427,s427,tv show,"weirdest, bestest, truest",,"charlie engelman, kirby engelman",,2020-08-21,2018,tv-g,"animals & nature, kids, variety",siblings kirby and charlie share strange discoveries and fun facts from the world of weird but true!,1,season
ts428,s428,tv show,disney junior t.o.t.s.: calling all t.o.t.s. (shorts),,"jet jurgensmeyer, christian simon, megan hilty",,2020-08-14,2020,tv-y,"animation, kids, music",what happens after the baby animals are delivered?,1,season
ts429,s429,movie,disney zombies 2,paul hoen,"milo manheim, meg donnelly, trevor tordjman, kylee russell, carla jeffery, chandler kinney",united states,2020-08-14,2020,tv-g,"coming of age, fantasy, musical",zed and addison encounter a group of werewolves!,84,min
ts430,s430,movie,india's wild leopards,,"sandesh kadur, priya singh",india,2020-08-14,2020,tv-14,"animals & nature, documentary",cameraman sandesh kadur’s mission is to uncover the secretive lives of india’s leopards.,45,min
ts431,s431,tv show,jungle animal rescue,,dan nachtrab,united states,2020-08-14,2019,tv-pg,"animals & nature, docuseries, family",a team of conservationists and veterinarians helps india’s people and wildlife coexist.,1,season
ts432,s432,movie,magic camp,mark waters,"adam devine, gillian jacobs, nathaniel mcintyre, jeffrey tambor, cole sand, isabella crovetti",united states,2020-08-14,2020,pg,"comedy, family",a group of misfit campers help a down-on-his-luck magician rediscover his love of magic.,101,min
ts433,s433,movie,marvel studios' ant-man and the wasp,peyton reed,"paul rudd, evangeline lilly, michael peña, walton goggins, hannah john-kamen, david dastmalchian",united states,2020-08-14,2018,pg-13,"action-adventure, comedy, science fiction",ant-man and the wasp must join forces to uncover secrets from the past.,120,min
ts434,s434,tv show,nature boom time,,"charlie engelman, kirby engelman, patrick rahill",united states,2020-08-14,2016,tv-g,"animals & nature, docuseries, kids","charlie, kirby, and patrick travel around the u.s. to learn about what makes nature awesome.",1,season
ts435,s435,tv show,sam's zookeeper challenge,,sam peltz,united states,2020-08-14,2018,tv-g,"animals & nature, docuseries, family",sam is put to the test to care for animals in “zookeeper’s challenge.”,1,season
ts436,s436,tv show,scuba sam's world,,sam peltz,united states,2020-08-14,2018,tv-g,"animals & nature, docuseries, kids",take a deep dive and learn all about the beloved sea animals in our oceans!,1,season
ts437,s437,tv show,spaced out,,ben detour,,2020-08-14,2018,tv-g,"docuseries, kids",learn about our universe through imagery taken from the hubble space telescope.,1,season
ts438,s438,movie,the greatest showman,michael gracey,"hugh jackman, zac efron, michelle williams, rebecca ferguson, zendaya , keala settle",united states,2020-08-14,2017,pg,"biographical, drama, family",a bold and original musical celebrating the birth of show business and dreams coming to life.,106,min
ts439,s439,tv show,weird but true!,,"charlie engelman, kirby engelman",united states,2020-08-14,2017,tv-g,"animals & nature, kids, variety","come along as we reveal fun, strange & surprising facts about our world in weird but true!",3,seasons
ts440,s440,tv show,wild cats of india,,james murray,united states,2020-08-14,2020,tv-pg,"animals & nature, docuseries, family",journey across the country’s landscapes to paint an intimate portrait of india's wild cats.,1,season
ts441,s441,movie,howard,don hahn,howard ashman,united states,2020-08-07,2020,tv-pg,"biographical, documentary, music","“howard” is the untold story of howard ashman, the brilliant lyricist behind disney classics.",95,min
ts442,s442,movie,prince of persia: the sands of time,mike newell,"jake gyllenhaal, ben kingsley, gemma arterton, alfred molina, richard coyle, toby kebbell",united states,2020-08-07,2010,pg-13,"action-adventure, fantasy",a rogue prince and rival princess safeguard a magical dagger with the power to reverse time.,117,min
ts443,s443,movie,star wars: galaxy's edge-adventure awaits,,"neil harris, kaley cuoco, oscar isaac, sarah hyland, keegan-michael key, jay leno",united states,2020-08-07,2019,tv-pg,"documentary, family",celebrating disney’s new land that brings star wars to life!,81,min
ts444,s444,movie,the hidden kingdoms of china,"ben wallis, emma fraser, jess tombs",michelle yeoh,united states,2020-08-07,2020,tv-pg,"animals & nature, documentary, family",the hidden kingdoms of china takes audiences into the secret wilds of china.,88,min
ts445,s445,movie,the peanuts movie,steve martino,"noah schnapp, alex garfin, hadley miller, mariel sheets, venus schultheis, noah johnston",united states,2020-08-07,2015,g,"animation, comedy, family","snoopy takes to the skies against the red baron, while his pal, charlie brown, begins an epic quest.",89,min
ts446,s446,tv show,ufo europe: the untold stories,,robert ashby,,2020-08-07,2012,tv-pg,"docuseries, reality",a selection of stories featuring encounters and sightings of the unexplained.,1,season
ts447,s447,tv show,animal showdown,,brian peck,,2020-07-31,2018,tv-g,"animals & nature, docuseries, family",animals face-off in this surprising competition of the toughest and biggest in the animal kingdom.,1,season
ts448,s448,tv show,best job ever,,,,2020-07-31,2018,tv-g,"animals & nature, docuseries, family",check out the cool jobs nat geo explorers do every day!,1,season
ts449,s449,movie,big cat games,jeremy turner,boone smith,,2020-07-31,2015,tv-pg,"animals & nature, family, reality","boone smith hosts a feline showdown as lion, tiger and cheetah battle for top cat title.",44,min
ts450,s450,movie,black is king,beyoncé knowles-carter,beyoncé knowles-carter,united states,2020-07-31,2020,tv-14,"dance, music, musical","this visual album from beyoncé reimagines lessons of ""the lion king"" for young kings and queens.",86,min
ts451,s451,movie,cradle of the gods,tim conrad,tim conrad,united kingdom,2020-07-31,2012,tv-pg,"documentary, historical","located on a hilltop sanctuary, g – bekli tepe in turkey is the world's first known temple.",45,min
ts452,s452,tv show,destination world,,rick robles,,2020-07-31,2018,tv-g,"animals & nature, docuseries, kids",check out the continents and find out what makes them unique from each other!,1,season
ts453,s453,tv show,fearless adventures with jack randall,,jack randall,,2020-07-31,2018,tv-pg,"animals & nature, docuseries, family",check out jack randall go head-to-head with all kinds of critters.,1,season
ts454,s454,movie,hunt for the abominable snowman,dan oliver,stephen rashbrook,,2020-07-31,2011,tv-pg,documentary,"across the himalayas are stories of the yeti, or abominable snowman.",45,min
ts455,s455,movie,incredibles 2,brad bird,"craig nelson, holly hunter, sarah vowell, huckleberry milner, catherine keener, eli fucile",united states,2020-07-31,2018,pg,"action-adventure, animation, family",the incredibles spring into action when a dangerous new villain emerges.,118,min
ts456,s456,tv show,king fishers,,stephen mangan,united kingdom,2020-07-31,2013,tv-pg,"action-adventure, animals & nature, docuseries","with so many fishermen and so many fishing disciplines, who is best?",1,season
ts457,s457,movie,lost temple of the inca,jim aikman,dan nachtrab,united states,2020-07-31,2020,tv-pg,documentary,a scientist discovers artifacts in peru that could lead him to one of the country’s missing temples.,44,min
ts458,s458,tv show,marvel funko shorts,,,,2020-07-31,2016,tv-y7,"action-adventure, animation, anthology",marvel and funko present pop! style marvel heroes.,2,seasons
ts459,s459,tv show,muppets now,,"dave goelz, matt vogel, david rudman, peter linz, bill barretta, eric jacobson",united states,2020-07-31,2020,tv-pg,"comedy, family, lifestyle",the muppets have a brand-new series ready to stream… but only if they can upload it in time.,1,season
ts460,s460,movie,surviving the mount st. helens disaster,sophie harris,bill ratner,united kingdom,2020-07-31,2020,tv-pg,"animals & nature, documentary",eyewitness accounts and rare images chart the violent 1980 eruption of mount st. helens.,44,min
ts461,s461,tv show,what sam sees,,sam peltz,,2020-07-31,2018,tv-g,"animals & nature, docuseries, family","join sam on an underwater journey and learn about sharks, eels, and more!",1,season
ts462,s462,movie,pirates of the caribbean: dead men tell no tales,"joachim rønning, espen sandberg","johnny depp, javier bardem, brenton thwaites, kaya scodelario, kevin mcnally, golshifteh farahani",united states,2020-07-24,2017,pg-13,"action-adventure, fantasy",captain jack sparrow searches for the trident of poseidon.,129,min
ts463,s463,tv show,pj masks (shorts),,,,2020-07-24,2017,tv-y,"action-adventure, animation, kids",the pj masks are protecting the city from villains!,1,season
ts464,s464,tv show,rogue trip,,"bob woodruff, mack woodruff",,2020-07-24,2020,tv-pg,"buddy, docuseries",bob woodruff and his son travel the world searching for beauty and adventure in unexpected places.,1,season
ts465,s465,tv show,wild congo,,corey johnson,,2020-07-24,2014,tv-pg,"animals & nature, docuseries, family",the congo: the most mysterious river in the dark heart of africa.,1,season
ts466,s466,tv show,wild sri lanka,,paul mcgann,united kingdom,2020-07-24,2016,tv-pg,"animals & nature, docuseries",this three-part series reveals the spectacular nature and amazing wildlife of sri lanka.,1,season
ts467,s467,movie,a pre-opening report from disneyland,wilfred jackson,"walt disney, winston hibler",united states,2020-07-17,1955,tv-pg,"documentary, family, historical",walt provides a look at the details needed to get the park ready to open. see details for advisory.,55,min
ts468,s468,movie,diary of a wimpy kid: the long haul,david bowers,"jason drucker, alicia silverstone, tom scott, charlie wright, owen asztalos, dylan walters",united states,2020-07-17,2017,pg,"comedy, family",a trip to meemaw’s 90th birthday takes a detour due to greg’s scheme to attend a gaming convention!,92,min
ts469,s469,tv show,disney junior music lullabies,,,,2020-07-17,2018,tv-y,"animation, kids, music",disney junior songs reimagined as calming lullabies.,1,season
ts470,s470,movie,lost city of machu picchu,,craig sechler,united states,2020-07-17,2019,tv-14,"documentary, family",who were the mysterious people who built machu picchu and why?,44,min
ts471,s471,tv show,super robot monkey team hyperforce go!,,"greg cipes, kevin michael	richardson, tom kenny, kari wahlgren, clancy brown, corey feldman","united states, japan",2020-07-17,2004,tv-y7,"action-adventure, animation, anime",chiro and a team of five robot monkeys defend shuggazoom city against skeleton king and his minions.,2,seasons
ts472,s472,movie,the mouseketeers at walt disney world,john tracy,"jo worley, ronnie schell, dennis underwood, leslie norris, billy attmore, scott craig",united states,2020-07-17,1977,tv-pg,"coming of age, drama, family",the mouseketeers arrive to perform at walt disney world. see details for advisory.,56,min
ts473,s473,tv show,wild chile,,peter venn,united kingdom,2020-07-17,2017,tv-pg,"animals & nature, docuseries, family",this beautiful and intriguing blue-chip series explores the incredibly varied wildlife of chile.,1,season
ts474,s474,movie,x-men: apocalypse,bryan singer,"james mcavoy, michael fassbender, jennifer lawrence, oscar isaac, nicholas hoult, rose byrne",united states,2020-07-17,2016,pg-13,"action-adventure, family, science fiction","apocalypse, the most powerful mutant in the universe, tries to destroy all of mankind.",144,min
ts475,s475,tv show,cosmos: a spacetime odyssey,,"neil tyson, stoney emshwiller",united states,2020-07-10,2013,tv-pg,"action-adventure, docuseries, family",a 13-part adventure across the universe of space and time.,1,season
ts476,s476,movie,hamilton: history has its eyes on you,,"lin-manuel miranda, thomas kail, christopher jackson, leslie odom jr., phillipa soo, renee goldsberry",united states,2020-07-10,2020,tv-pg,"historical, musical","robin roberts hosts a discussion with lin-manuel miranda, thomas kail, and original cast members.",47,min
ts477,s477,movie,solo: a star wars story,ron howard,"alden ehrenreich, woody harrelson, emilia clarke, donald glover, thandie newton, phoebe waller-bridge",united states,2020-07-10,2018,pg-13,"action-adventure, crime, science fiction",witness the beginning of the star wars saga's most unlikely hero.,135,min
ts478,s478,movie,x-men: days of future past,bryan singer,"hugh jackman, james mcavoy, michael fassbender, jennifer lawrence, halle berry, nicholas hoult","united states, united kingdom, canada",2020-07-10,2014,pg-13,"action-adventure, family, science fiction",characters from the x-men trilogy join their younger selves to change the past and save our future.,132,min
ts479,s479,movie,the undefeated presents: hamilton in-depth,,"lin-manuel miranda, thomas kail, renee goldsberry, leslie odom jr., daveed diggs, phillipa soo",united states,2020-07-05,2020,tv-pg,"historical, musical",the undefeated presents: hamilton in-depth is a roundtable discussion with 9 stars and the director.,33,min
ts480,s480,tv show,animal er,,dr. brian beale,united states,2020-07-03,2016,tv-pg,"animals & nature, docuseries, family",animal er brings you up close to the bleeding edge of animal care.,2,seasons
ts481,s481,movie,diary of a wimpy kid: rodrick rules,david bowers,"zachary gordon, devon bostick, rachael harris, robert capron, steve zahn",united states,2020-07-03,2011,pg,"comedy, family","in 7th grade, greg must bond with his brother, rodrick while also impressing the new girl in town.",100,min
ts482,s482,movie,hamilton,thomas kail,"daveed diggs, renée goldsberry, jonathan groff, christopher jackson, jasmine jones, lin-manuel miranda",united states,2020-07-03,2020,pg-13,"biographical, historical, musical",the filmed version of broadway original “hamilton” that soars in music and tale.,160,min
ts483,s483,movie,ice age: collision course,mike thurmeier,"ray romano, john leguizamo, denis leary, adam devine, jesse ferguson, max greenfield","united states, united kingdom, australia",2020-07-03,2016,pg,"action-adventure, animation, comedy","when their world is threatened, manny and friends go on a quest to survive the scrat-tastrophe!",97,min
ts484,s484,movie,race to witch mountain,andy fickman,"dwayne johnson, annasophia robb, carla gugino, ciarán hinds, alexander ludwig, tom scott",united states,2020-07-03,2009,pg,"action-adventure, family, science fiction",a las vegas cab driver helps two aliens disguised as teens get home to save their planet... and ours.,100,min
ts485,s485,movie,the big green,holly sloan,"steve guttenberg, olivia d'abo, jay sanders, john terry, chauncey leopardi, patrick renna",united states,2020-07-03,1995,pg,"comedy, family, sports",a group of bored misfits become local soccer heroes in a sleepy texas town.,100,min
ts486,s486,movie,the mighty ducks,stephen herek,"emilio estevez, joss ackland, lane smith, heidi kling, josef sommer, joshua jackson",united states,2020-07-03,1992,pg,"comedy, drama, sports",a hotshot lawyer reluctantly coaches a hapless pee wee hockey team.,104,min
ts487,s487,movie,while you were sleeping,jon turteltaub,"sandra bullock, bill pullman, peter gallagher, peter boyle, glynis johns, micole mercurio",united states,2020-07-03,1995,pg,"comedy, drama, romance",a lonely subway worker is mistaken for a comatose man's finacée.,104,min
ts488,s488,tv show,disney a.n.t. farm,,"china mcclain, sierra mccormick, jake short, stefanie scott, carlon jeffery",united states,2020-06-26,2011,tv-g,"comedy, coming of age, music",chyna sparks and her friends are the newest members of the a.n.t. program.,3,seasons
ts489,s489,tv show,into the unknown: making frozen 2,,"kristen bell, idina menzel, josh gad, jonathan groff, jennifer lee, chris buck",united states,2020-06-26,2020,tv-pg,"docuseries, family","for the first time, go behind-the-scenes into the making of the #1 animated film, frozen 2.",1,season
ts490,s490,movie,man in space,ward kimball,"walt disney, dick tufeld, ward kimball, willy ley, dr. heinz haber, dr. wernher von braun",united states,2020-06-26,1955,tv-pg,"documentary, family","from the tv series disneyland, a look at the history of space travel. see details for advisory.",49,min
ts491,s491,movie,mars and beyond,ward kimball,"walt disney, paul frees, dr. ernst stuhlinger, dr. wernher von braun, dr. e.c. slipher",united states,2020-06-26,1957,tv-g,"animation, documentary, family",an animated look at humankind's early views of the universe and life on mars.,53,min
ts492,s492,movie,marvel studios' avengers: infinity war,"anthony russo, joe russo","robert downey jr., chris hemsworth, mark ruffalo, chris evans, scarlett johansson, don cheadle",united states,2020-06-26,2018,pg-13,"action-adventure, fantasy, science fiction",the avengers must be willing to sacrifice all to defeat thanos.,152,min
ts493,s493,movie,tarzan,"kevin lima, chris buck","tony goldwyn, minnie driver, glenn close, alex linz, rosie o'donnell, brian blessed",united states,2020-06-26,1999,g,"action-adventure, animation, coming of age","adopted by gorillas, tarzan’s life changes forever when he meets other humans.",93,min
ts494,s494,movie,tarzan ii,brian smith,"harrison chad, george carlin, brad garrett, ron perlman, estelle harris, glenn close",united states,2020-06-26,2005,g,"action-adventure, animation, coming of age",young tarzan decides his ape family would be better off without him.,75,min
ts495,s495,tv show,101 dalmatians (series),,"jeff bennett, christine cavanaugh, tara charendoff, jim cummings, tress macneille, charlotte rae",,2020-06-19,1997,tv-y7,"action-adventure, animation, kids",the dearly family move to a new farm home in the country.,1,season
ts496,s496,movie,big sur: wild california,,hector elizondo,united states,2020-06-19,2010,tv-pg,"animals & nature, documentary, family",why is california's big sur coastline experiencing an explosion in wildlife?,47,min
ts497,s497,tv show,disney junior muppet babies play date,,,,2020-06-19,2018,tv-y,"comedy, kids",time for a playdate with the muppet babies!,1,season
ts498,s498,movie,egypt's treasure guardians,"ben allen, tom jenner",dominic frisby,united kingdom,2020-06-19,2016,tv-pg,"documentary, historical","this programme follows a select cast of individuals, determined to bring egypt back from the brink.",44,min
ts499,s499,movie,the jungle book,jon favreau,"bill murray, ben kingsley, idris elba, lupita nyong'o, scarlett johansson, giancarlo esposito","united kingdom, united states",2020-06-19,2016,pg,"action-adventure, coming of age, family",a man-cub who’s been raised by a family of wolves eludes a dangerous tiger.,108,min
ts500,s500,movie,the pirate fairy,peggy holmes,"mae whitman, christina hendricks, tom hiddleston, lucy liu, raven-symoné , megan hilty",united states,2020-06-19,2014,g,"action-adventure, animation, family",tinker bell and friends face the pirates of skull rock to save a friend.,78,min
ts501,s501,movie,trail mix-up,barry cook,"charles fleischer, kathleen turner, april winchell, lou hirsch, corey burton, frank welker",united states,2020-06-19,1993,tv-g,"action-adventure, animation, comedy",roger rabbit is left to care for baby herman in yellowstone national park.,9,min
ts502,s502,movie,tummy trouble,"frank marshall, rob minkoff","charles fleischer, april winchell, lou hirsch, corey burton, richard williams, kathleen turner",united states,2020-06-19,1989,tv-g,"action-adventure, animation, comedy",roger rabbit is left to babysit with the mischievous baby herman,8,min
ts503,s503,movie,artemis fowl,kenneth branagh,,united states,2020-06-12,2020,pg,"action-adventure, crime, fantasy",a descendant of a long line of criminal masterminds seeks to find his father who has disappeared.,96,min
ts504,s504,tv show,mighty med,,"bradley perry, jake short, paris berelc, devan leos",united states,2020-06-12,2013,tv-y7,"comedy, coming of age, medical","check in to mighty med, the secret superhero hospital.",2,seasons
ts505,s505,movie,the liberty story,"hamilton luske, robert stevenson",walt disney,united states,2020-06-12,1957,tv-pg,"drama, family, historical",walt disney presents segments of america's fight for freedom. see details for advisory.,48,min
ts506,s506,movie,the story of the animated drawing,"wilfred jackson, william beaudine",,united states,2020-06-12,1955,tv-pg,"documentary, family",walt disney discusses the history of animation. see details for advisory.,49,min
